{
  "activation": {
    "activation_owner": "consumer",
    "enabled": false
  },
  "applicability": {
    "constraints": [
      "Select only the exact task-matched release.",
      "This role pack grants no tool, deployment, or mutation authority."
    ],
    "role_class": "design-and-development-consumer",
    "scope": "organization",
    "task_classes": [
      "motion",
      "interaction",
      "prototype",
      "expo",
      "swift"
    ]
  },
  "compatibility": {
    "min_contract_version": "0.2",
    "runtime_profiles": [
      "cursor-macos",
      "codex-macos"
    ]
  },
  "description": "Reference-only exact releases; consumer activation remains false until qualification and consumer proof.",
  "display_name": "Emil Kowalski Design Skills reference pack",
  "release_refs": [
    {
      "artifact_digest": "sha256:63db7bccb9796eb388daec02c3e37a2bf364689d5d89f687fb94feeb8209686e",
      "eligibility_ref": "opaque:eligibility:emil-animate-ineligible",
      "release_id": "emil-animate@1.0.0",
      "required": false
    },
    {
      "artifact_digest": "sha256:0ff6391a272eccc5ec4928340e41a2b581efec72985ecdee718146689d4df45d",
      "eligibility_ref": "opaque:eligibility:emil-animate-expo-ineligible",
      "release_id": "emil-animate-expo@1.0.0",
      "required": false
    },
    {
      "artifact_digest": "sha256:993934d65a9e55300af5c0a34bd5bc0fff77704bcb2c788dbdfb1dc40aa8bbe9",
      "eligibility_ref": "opaque:eligibility:emil-animation-vocabulary-ineligible",
      "release_id": "emil-animation-vocabulary@1.0.0",
      "required": false
    },
    {
      "artifact_digest": "sha256:bcf64f19f281679da977f86ec6f64f79748a6901a3fb4265310740f2a3d7193e",
      "eligibility_ref": "opaque:eligibility:emil-apple-design-ineligible",
      "release_id": "emil-apple-design@1.0.0",
      "required": false
    },
    {
      "artifact_digest": "sha256:9bf3c5eb32e7f605199a5ecb5d5a74fe3fac9e06f317b326a2bbf3f02fc704a9",
      "eligibility_ref": "opaque:eligibility:emil-ask-sonner-ineligible",
      "release_id": "emil-ask-sonner@1.0.0",
      "required": false
    },
    {
      "artifact_digest": "sha256:400bfc518a7bc79f7f76ffbf518c5ccaaa648d56caebf07750c6ed2abbfc0bbd",
      "eligibility_ref": "opaque:eligibility:emil-emil-design-eng-ineligible",
      "release_id": "emil-emil-design-eng@1.0.0",
      "required": false
    },
    {
      "artifact_digest": "sha256:3c5412b317e988ed6c9c87dd98722358db90ff526dd9a4d516e8779043b0bf52",
      "eligibility_ref": "opaque:eligibility:emil-find-animation-opportunities-ineligible",
      "release_id": "emil-find-animation-opportunities@1.0.0",
      "required": false
    },
    {
      "artifact_digest": "sha256:3beac5b40896407d6dee6dd244f54aadc7d8a8eea3813bc1133ab5037c46e265",
      "eligibility_ref": "opaque:eligibility:emil-improve-animations-ineligible",
      "release_id": "emil-improve-animations@1.0.0",
      "required": false
    },
    {
      "artifact_digest": "sha256:5e6d250f1e7ec5267a5608e16aab8b6c66c018242b4342619cf23e6c9fe4bd33",
      "eligibility_ref": "opaque:eligibility:emil-pick-ui-library-ineligible",
      "release_id": "emil-pick-ui-library@1.0.0",
      "required": false
    },
    {
      "artifact_digest": "sha256:cbe766ae130d9a66a4a48509c87c5734fc1949dda50a3e5ed623e1c6c0fe1db1",
      "eligibility_ref": "opaque:eligibility:emil-prototype-ineligible",
      "release_id": "emil-prototype@1.0.0",
      "required": false
    },
    {
      "artifact_digest": "sha256:1f9fe8b0d6b1542997ba822f067f3fcebbebffaa7f92bacfc03d8a9e2426bd5d",
      "eligibility_ref": "opaque:eligibility:emil-review-animations-ineligible",
      "release_id": "emil-review-animations@1.0.0",
      "required": false
    },
    {
      "artifact_digest": "sha256:ca5898ed8fdc3d59b6990765643ecf742ebce1c30b8dc0af11924331142442b0",
      "eligibility_ref": "opaque:eligibility:emil-write-swift-ineligible",
      "release_id": "emil-write-swift@1.0.0",
      "required": false
    }
  ],
  "required_capability_classes": [
    "design.motion",
    "development.mobile"
  ],
  "role_pack_id": "emil-design-reference",
  "schema_version": "0.1",
  "trust_boundary": "linkskills-role-pack",
  "version": "1.0.0"
}
